{
  "profile_id": "freelance_contract",
  "version": "1.0.0",
  "validation_status": "Validated",
  "review_date": "2026-07-24",
  "metadata": {
    "display_name": "Freelance / Independent Contractor Agreement",
    "family": "employment_agreements",
    "description": "Standard Freelance / Independent Contractor Agreement profile mapping required clauses.",
    "aliases": [
      "freelance contract",
      "independent contractor agreement",
      "contractor agreement",
      "perjanjian freelance",
      "perjanjian kontraktor independen"
    ],
    "release_stage": "stable"
  },
  "coverage": {
    "languages": [
      "EN",
      "ID",
      "FR"
    ],
    "jurisdictions": [
      "Indonesia",
      "Belgium",
      "France",
      "Netherlands",
      "England & Wales",
      "United States"
    ]
  },
  "classification": {
    "nli_hypothesis": "This document is a freelance or independent contractor agreement engaging a self-employed individual to perform services.",
    "keyword_overrides": {
      "EN": [
        "freelance contract",
        "independent contractor agreement",
        "contractor agreement",
        "freelance"
      ],
      "ID": [
        "perjanjian freelance",
        "perjanjian kontraktor independen",
        "kontraktor independen"
      ]
    }
  },
  "required_clauses": [
    {
      "clause_id": "governing_law"
    },
    {
      "clause_id": "jurisdiction_venue"
    },
    {
      "clause_id": "scope_of_services"
    },
    {
      "clause_id": "payment_terms"
    },
    {
      "clause_id": "ip_ownership"
    },
    {
      "clause_id": "termination"
    },
    {
      "clause_id": "dispute_resolution"
    }
  ],
  "recommended_clauses": [],
  "dangerous_clauses": [],
  "abusive_clauses": [],
  "leonine_clauses": [],
  "legal_references": []
}