{
  "profile_id": "sales_representative_agreement",
  "version": "1.0.0",
  "validation_status": "Validated",
  "review_date": "2026-07-24",
  "metadata": {
    "display_name": "Sales Representative Agreement",
    "family": "commercial_agreements",
    "description": "Standard Sales Representative Agreement profile mapping required clauses.",
    "aliases": [
      "sales representative agreement",
      "sales agent agreement",
      "perjanjian perwakilan penjualan"
    ],
    "release_stage": "stable"
  },
  "coverage": {
    "languages": [
      "EN",
      "ID",
      "FR"
    ],
    "jurisdictions": [
      "Indonesia",
      "Belgium",
      "France",
      "Netherlands",
      "England & Wales",
      "United States"
    ]
  },
  "classification": {
    "nli_hypothesis": "This document is a sales representative agreement in which a representative sells the principal's products, typically for commission.",
    "keyword_overrides": {
      "EN": [
        "sales representative agreement",
        "sales agent agreement",
        "perwakilan penjualan"
      ],
      "ID": [
        "perjanjian perwakilan penjualan"
      ]
    }
  },
  "required_clauses": [
    {
      "clause_id": "governing_law"
    },
    {
      "clause_id": "jurisdiction_venue"
    },
    {
      "clause_id": "scope_of_services"
    },
    {
      "clause_id": "compensation"
    },
    {
      "clause_id": "termination"
    },
    {
      "clause_id": "dispute_resolution"
    }
  ],
  "recommended_clauses": [],
  "dangerous_clauses": [],
  "abusive_clauses": [],
  "leonine_clauses": [],
  "legal_references": []
}