{
  "profile_id": "service_agreement",
  "version": "1.0.0",
  "validation_status": "Validated",
  "review_date": "2026-07-13",
  "metadata": {
    "display_name": "Service Agreement",
    "family": "commercial_agreements",
    "description": "Standard Service Agreement profile mapping required clauses.",
    "aliases": [
      "service agreement",
      "services agreement",
      "master services agreement",
      "MSA"
    ],
    "release_stage": "stable"
  },
  "coverage": {
    "languages": [
      "EN",
      "ID",
      "FR"
    ],
    "jurisdictions": [
      "Indonesia",
      "Belgium",
      "France",
      "Netherlands",
      "England & Wales",
      "United States"
    ]
  },
  "classification": {
    "nli_hypothesis": "This document covers the provision of services.",
    "keyword_overrides": {
      "EN": [
        "services",
        "client",
        "contractor",
        "provider"
      ],
      "ID": [
        "jasa",
        "perjanjian jasa",
        "pemberi jasa"
      ]
    }
  },
  "required_clauses": [
    {
      "clause_id": "governing_law"
    },
    {
      "clause_id": "jurisdiction_venue"
    },
    {
      "clause_id": "scope_of_services"
    },
    {
      "clause_id": "payment_terms"
    },
    {
      "clause_id": "termination"
    },
    {
      "clause_id": "limitation_liability"
    },
    {
      "clause_id": "dispute_resolution"
    }
  ],
  "recommended_clauses": [],
  "dangerous_clauses": [],
  "abusive_clauses": [],
  "leonine_clauses": [],
  "legal_references": []
}