{
  "profile_id": "employment_contract",
  "version": "1.0.0",
  "validation_status": "Validated",
  "review_date": "2026-07-24",
  "metadata": {
    "display_name": "Employment Contract",
    "family": "employment_agreements",
    "description": "Standard Employment Contract profile mapping required clauses.",
    "aliases": [
      "employment contract",
      "employment agreement",
      "work agreement",
      "kontrak kerja",
      "perjanjian kerja"
    ],
    "release_stage": "stable"
  },
  "coverage": {
    "languages": [
      "EN",
      "ID",
      "FR"
    ],
    "jurisdictions": [
      "Indonesia",
      "Belgium",
      "France",
      "Netherlands",
      "England & Wales",
      "United States"
    ]
  },
  "classification": {
    "nli_hypothesis": "This document involves employment terms between employer and employee.",
    "keyword_overrides": {
      "EN": [
        "employment contract",
        "employment agreement",
        "work agreement"
      ],
      "ID": [
        "kontrak kerja",
        "perjanjian kerja"
      ]
    }
  },
  "required_clauses": [
    {
      "clause_id": "governing_law"
    },
    {
      "clause_id": "jurisdiction_venue"
    },
    {
      "clause_id": "termination"
    },
    {
      "clause_id": "notice_period"
    },
    {
      "clause_id": "compensation"
    },
    {
      "clause_id": "working_hours"
    },
    {
      "clause_id": "dispute_resolution"
    }
  ],
  "recommended_clauses": [],
  "dangerous_clauses": [],
  "abusive_clauses": [],
  "leonine_clauses": [],
  "legal_references": []
}