{
  "profile_id": "partnership_agreement",
  "version": "1.0.0",
  "validation_status": "Validated",
  "review_date": "2026-07-24",
  "metadata": {
    "display_name": "Partnership Agreement",
    "family": "corporate_agreements",
    "description": "Standard Partnership Agreement profile mapping required clauses.",
    "aliases": [
      "partnership agreement",
      "perjanjian kemitraan",
      "contrat de partenariat"
    ],
    "release_stage": "stable"
  },
  "coverage": {
    "languages": [
      "EN",
      "ID",
      "FR"
    ],
    "jurisdictions": [
      "Indonesia",
      "Belgium",
      "France",
      "Netherlands",
      "England & Wales",
      "United States"
    ]
  },
  "classification": {
    "nli_hypothesis": "This document establishes a business partnership between parties.",
    "keyword_overrides": {
      "EN": [
        "partnership agreement",
        "contrat de partenariat"
      ],
      "ID": [
        "perjanjian kemitraan"
      ]
    }
  },
  "required_clauses": [
    {
      "clause_id": "governing_law"
    },
    {
      "clause_id": "jurisdiction_venue"
    },
    {
      "clause_id": "capital_contribution"
    },
    {
      "clause_id": "profit_sharing"
    },
    {
      "clause_id": "management_rights"
    },
    {
      "clause_id": "termination"
    },
    {
      "clause_id": "dispute_resolution"
    }
  ],
  "recommended_clauses": [],
  "dangerous_clauses": [],
  "abusive_clauses": [],
  "leonine_clauses": [],
  "legal_references": []
}